{
  "schema_version": "1.0",
  "event_id": "fixture-close-short-1",
  "source_event_id": "fixture-source-5",
  "timestamp": "2026-03-07T00:00:00Z",
  "decision": {
    "action": "CLOSE_SHORT",
    "symbol": "DOGEUSDT",
    "quantity": 10.0,
    "leverage": 2.0,
    "entry_price": 1.0,
    "stop_loss": 0.0,
    "take_profit": 0.0,
    "reason": "fixture",
    "smart_copy_compatible": true
  }
}
